{
  "id": "force_dimension_sigma",
  "name": "Sigma",
  "db_added": "2025-07-30",
  "introduction_year": 2025,
  "urls": [
    {
      "caption": "Force Dimension Official Website",
      "url": "https://www.forcedimension.com"
    },
    {
      "caption": "Force Dimension sigma.7 Product Page",
      "url": "https://www.forcedimension.com/products/sigma"
    },
    {
      "caption": "Virtual Incision MIRA (surgical system integrating Sigma)",
      "url": "https://medmachina.github.io/robot/virtual_incision_mira"
    }
  ],
  "photos": [
    {
      "url": "https://www.forcedimension.com/images/2020/08/01/banner-sigma.jpg",
      "site": "https://www.forcedimension.com/products/sigma"
    },
    {
      "url": "https://www.forcedimension.com/images/2020/08/01/sigma-1.jpg",
      "site": "https://www.forcedimension.com/products/sigma"
    }
  ],
  "tags": [
    "Haptic device",
    "OEM component"
  ],
  "description": "The sigma.7 by Force Dimension is an active 7-degree-of-freedom haptic master interface that pairs a delta parallel-kinematic base for 3-DOF translational motion with an active motorized 3-DOF gimbal wrist and a 1-DOF motorized pinch gripper. Available in dedicated left- and right-hand configurations with active gravity compensation and kHz-rate control, it delivers simultaneous 3-DOF translational force feedback, 3-DOF rotational torque feedback, and 1-DOF grasping force feedback. It is designed for bimanual teleoperation workstations and OEM integration into surgical consoles, such as the Virtual Incision MIRA surgical system.",
  "also_known_as": [
    "sigma.7",
    "sigma 7"
  ]
}
