{
  "id": "medtronic_hugo_ras",
  "name": "Hugo RAS",
  "db_added": "2025-07-30",
  "introduction_year": 2021,
  "urls": [
    {
      "caption": "Medtronic, Hugo RAS",
      "url": "https://www.medtronic.com/covidien/en-au/robotic-assisted-surgery/hugo-ras-system.html"
    }
  ],
  "photos": [
    {
      "url": "https://www.medtronic.com/content/dam/medtronic-wide/public/united-states/products/surgical-robotics/robotic-assisted-surgery/hugo-ras-system-hcp-or-setup-arm-use-b.jpg",
      "site": "https://www.medtronic.com/covidien/en-au/robotic-assisted-surgery/hugo-ras-system.html"
    },
    {
      "url": "https://www.medtronic.com/content/dam/medtronic-com/covidien/en-au/robotic-assisted-surgery/hugo-ras-system-module.jpg",
      "site": "https://www.medtronic.com/covidien/en-au/robotic-assisted-surgery/hugo-ras-system.html"
    },
    {
      "url": "https://www.medtronic.com/content/dam/medtronic-com/global/corporate/newsroom/media-kits/robotics/hugo-ras-system-overview.jpg",
      "caption": "Hugo RAS"
    }
  ],
  "tags": [
    "RAMIS",
    "Teleoperated",
    "Multiple patient carts",
    "Multiple ports",
    "3+ instruments",
    "Stereo display",
    "Stereo endoscope",
    "Mechanical Cartesian manipulation",
    "Mechanical RCM",
    "Commercial"
  ],
  "usages": [
    "Abdominal",
    "Gynecological",
    "Urological"
  ],
  "description": "The Hugo Robotic-Assisted Surgery (RAS) system is a modular multiport teleoperated platform developed by Medtronic for minimally invasive surgery. It features up to four independent mobile arm carts that can be positioned flexibly around the operating table, an open surgeon console with an HD 3D stereoscopic display viewed with passive glasses, and pistol-grip controllers. Utilizing mechanical remote centers of motion and wristed articulating instruments, the system is integrated with Karl Storz 3D visualization and Medtronic's digital surgery ecosystem. Hugo RAS has received CE mark certification, US FDA clearance, and international approvals for urologic, gynecologic, and general surgical procedures.",
  "also_known_as": [],
  "videos": [
    {
      "url": "https://www.youtube.com/watch?v=IG08p0ZpbQY",
      "title": "Robots Takeover Surgery! Medtronic Hugo RAS AI Robot Targets da Vinci Surgical Robot's Dominance"
    },
    {
      "url": "https://www.youtube.com/watch?v=SSPq-8O2t0g",
      "title": "Dr Premkumar Balachandran explains how robotic hernia surgery is done using Hugo RAS robotic system"
    },
    {
      "url": "https://www.youtube.com/watch?v=eQfLM4y-1I8",
      "title": "Medtronic's Exibition of the Hugo RAS: Robot Assisted Surgery"
    }
  ],
  "regulatory": [
    {
      "url": "https://www.accessdata.fda.gov/scripts/cdrh/cfdocs/cfpmn/pmn.cfm?ID=K250725",
      "body": "FDA 510k",
      "year": 2025,
      "product_code": "SCV",
      "panel": "SU"
    },
    {
      "url": "https://news.medtronic.com/2021-10-11-Medtronic-Receives-CE-Mark-for-Hugo-RAS-System",
      "body": "CE",
      "year": 2021,
      "product_code": "",
      "panel": ""
    },
    {
      "url": "https://news.medtronic.com/2022-10-19-Medtronic-Receives-CE-Mark-for-Hugo-RAS-System-for-General-Surgery",
      "body": "CE",
      "year": 2022,
      "product_code": "",
      "panel": ""
    }
  ],
  "publications": [
    {
      "title": "Robot-assisted Radical Prostatectomy with the Novel Hugo Robotic System: Initial Experience and Optimal Surgical Set-up at a Tertiary Referral Robotic Center",
      "url": "https://doi.org/10.1016/j.eururo.2022.04.029",
      "year": 2022,
      "journal": "European urology",
      "doi": "10.1016/j.eururo.2022.04.029",
      "pmid": "35568597",
      "citations": 108
    },
    {
      "title": "Robot-Assisted Laparoscopic Radical Prostatectomy Utilizing Hugo RAS Platform: Initial Experience",
      "url": "https://doi.org/10.1089/end.2022.0461",
      "year": 2023,
      "journal": "Journal of endourology",
      "doi": "10.1089/end.2022.0461",
      "pmid": "36205571",
      "citations": 59
    },
    {
      "title": "Outcomes of Robot-assisted Radical Prostatectomy with the Hugo RAS Surgical System: Initial Experience at a High-volume Robotic Center",
      "url": "https://doi.org/10.1016/j.euf.2023.01.008",
      "year": 2023,
      "journal": "European urology focus",
      "doi": "10.1016/j.euf.2023.01.008",
      "pmid": "36690548",
      "citations": 46
    },
    {
      "title": "Intraoperative Performance of DaVinci Versus Hugo RAS During Radical Prostatectomy: Focus on Timing, Malfunctioning, Complications, and User Satisfaction in 100 Consecutive Cases (the COMPAR-P Trial)",
      "url": "https://doi.org/10.1016/j.euros.2024.03.013",
      "year": 2024,
      "journal": "European urology open science",
      "doi": "10.1016/j.euros.2024.03.013",
      "pmid": "38591096",
      "citations": 32
    }
  ],
  "units_deployed": {
    "count": 200,
    "source_url": "https://www.medtronic.com/covidien/en-au/robotic-assisted-surgery/hugo-ras-system.html"
  }
}
