{
  "id": "kuka_lbr_med",
  "name": "LBR Med",
  "db_added": "2026-07-30",
  "introduction_year": null,
  "urls": [
    {
      "caption": "KUKA, LBR Med",
      "url": "https://www.kuka.com/medical-robotics"
    },
    {
      "caption": "ROPCA ARTHUR on MedMachina",
      "url": "https://medmachina.github.io/robot/ropca_arthur"
    },
    {
      "caption": "eCential Robotics on MedMachina",
      "url": "https://medmachina.github.io/robot/ecential_robotics_platform"
    },
    {
      "caption": "Andromeda Beacon on MedMachina",
      "url": "https://medmachina.github.io/robot/andromeda_beacon"
    }
  ],
  "photos": [
    {
      "url": "https://upload.wikimedia.org/wikipedia/commons/3/36/KUKA_LBR_Med.jpg",
      "site": "https://commons.wikimedia.org/wiki/File:KUKA_LBR_Med.jpg"
    },
    {
      "url": "https://upload.wikimedia.org/wikipedia/commons/b/b0/KUKA_LBR_iiwa.jpg",
      "site": "https://commons.wikimedia.org/wiki/File:KUKA_LBR_iiwa.jpg"
    }
  ],
  "tags": [
    "OEM component"
  ],
  "description": "7-axis lightweight collaborative robot arm (cobot) certified for integration into medical devices. Available in two variants: LBR Med 7 R800 (7 kg payload, 800 mm reach) and LBR Med 14 R820 (14 kg payload, 820 mm reach). Compliant with IEC 60601-1 (electrical safety) and IEC 62304 (medical software development lifecycle). Features redundant torque sensors in all seven joints enabling safe human-robot collaboration, gravity compensation, manual hand-guiding, and haptic feedback. Powered by KUKA Sunrise Cabinet Med and Sunrise.OS Med (Java-based). Biocompatible and corrosion-resistant surfaces suitable for operating room environments. Used as an OEM component in surgical assistance, diagnostics, radiotherapy, and rehabilitation systems, including [eCential Robotics](/robot/ecential_robotics_platform), [Andromeda Beacon](/robot/andromeda_beacon), and [ROPCA ARTHUR](/robot/ropca_arthur).",
  "also_known_as": []
}
