{
  "id": "ssii_mantra",
  "name": "Mantra",
  "db_added": "2025-07-30",
  "introduction_year": 2024,
  "urls": [
    {
      "caption": "SSI, Mantra",
      "url": "https://ssinnovations.com/ssi-mantra/"
    }
  ],
  "photos": [
    {
      "url": "https://ssinnovations.com/wp-content/uploads/2024/12/M3-PSAC-DEC241A-600x600.webp",
      "site": "https://ssinnovations.com/ssi-mantra/"
    },
    {
      "url": "https://ssinnovations.com/wp-content/uploads/2024/12/M3-VC-DEC241B-600x600.webp",
      "site": "https://ssinnovations.com/ssi-mantra/"
    },
    {
      "url": "https://ssinnovations.com/wp-content/uploads/2024/12/M3-SCC-DEC241A.webp",
      "site": "https://ssinnovations.com/ssi-mantra/"
    }
  ],
  "tags": [
    "RAMIS",
    "Teleoperated",
    "Multiple patient carts",
    "Multiple ports",
    "3+ instruments",
    "Stereo display",
    "Stereo endoscope",
    "Mechanical RCM",
    "Free hand manipulation",
    "Commercial"
  ],
  "usages": [
    "Abdominal",
    "Gynecological",
    "Urological"
  ],
  "description": "The SSI Mantra is a modular teleoperated surgical robotic system developed by SS Innovations in India. The platform consists of three to five independent mobile bedside robotic arm carts, an open surgeon console featuring a 3D flat-panel display viewed with polarized glasses, and an integrated 3D vision tower. Supporting articulating wristed instruments with motion scaling and tremor suppression, the system is designed for multiport minimally invasive surgery across urology, gynecology, general surgery, thoracic surgery, and robotic cardiac procedures (including beating-heart coronary revascularization). It is approved by India's CDSCO.",
  "also_known_as": [],
  "videos": [
    {
      "url": "https://www.youtube.com/watch?v=wC_FfcOVX4Y",
      "title": "The Story of SSI Mantra - India's First Surgical Robotic System"
    }
  ],
  "units_deployed": {
    "count": 65,
    "source_url": "https://ssinnovations.com/ssi-mantra/"
  }
}
