{
  "id": "j&j_velys",
  "name": "Velys",
  "db_added": "2025-07-30",
  "introduction_year": null,
  "urls": [
    {
      "caption": "Johnson & Johnson MedTech, Velys",
      "url": "https://www.jnjmedtech.com/en-US/patient/velys"
    }
  ],
  "photos": [
    {
      "url": "https://www.jnjmedtech.com/sites/default/files/images/VRAS_Robotic-Device_2023.jpg",
      "site": "https://www.jnjmedtech.com/en-US/patient/velys"
    },
    {
      "url": "https://www.jnjmedtech.com/sites/default/files/images/20_6065_VELYS-Product-084_W2_F_RGB.png",
      "site": "https://www.jnjmedtech.com/en-US/patient/velys"
    },
    {
      "url": "https://www.jnjmedtech.com/sites/default/files/images/VRAS_System_OR_2023.png",
      "site": "https://www.jnjmedtech.com/en-US/patient/velys"
    }
  ],
  "tags": [
    "Open surgery",
    "Orthopedic"
  ],
  "usages": [
    "Knee"
  ],
  "description": "The VELYS Robotic-Assisted Solution is an orthopedic robotic platform developed by DePuy Synthes (Johnson & Johnson MedTech) for total knee arthroplasty (TKA). Designed with a compact, table-mounted robotic arm that attaches directly to the operating room table rails, the system operates without requiring preoperative CT or MRI imaging (imageless navigation). It uses optical tracking arrays to evaluate joint stability and gap balance intraoperatively, while the robotic arm positions and stabilizes a saw cutting block along planned resection planes for surgeon-directed bone cuts. The system holds US FDA 510(k) clearance and CE mark approval.",
  "also_known_as": [],
  "videos": [
    {
      "url": "https://www.youtube.com/watch?v=jTXyi2Y0r1c",
      "title": "How is the robotic knee replacement surgery performed? (Velys™ system)"
    },
    {
      "url": "https://www.youtube.com/watch?v=tv_0Zt71F0Q",
      "title": "Knee Replacement Surgery at Wood County Hospital with the VELYS  Robotic Assisted Solution"
    }
  ],
  "regulatory": [
    {
      "url": "https://www.accessdata.fda.gov/scripts/cdrh/cfdocs/cfpmn/pmn.cfm?ID=K202769",
      "body": "FDA 510k",
      "year": 2021,
      "product_code": "OLO",
      "panel": "OR"
    },
    {
      "url": "https://www.accessdata.fda.gov/scripts/cdrh/cfdocs/cfpmn/pmn.cfm?ID=K233227",
      "body": "FDA 510k",
      "year": 2023,
      "product_code": "OLO",
      "panel": "OR"
    },
    {
      "url": "https://www.accessdata.fda.gov/scripts/cdrh/cfdocs/cfpmn/pmn.cfm?ID=K240211",
      "body": "FDA 510k",
      "year": 2024,
      "product_code": "OLO",
      "panel": "OR"
    },
    {
      "url": "https://www.jnjmedtech.com/en-US/patient/velys",
      "body": "CE",
      "year": 2023,
      "product_code": "",
      "panel": ""
    }
  ],
  "publications": [
    {
      "title": "Image-Free Robotic-Assisted Total Knee Arthroplasty Improves Implant Alignment Accuracy: A Cadaveric Study",
      "url": "https://doi.org/10.1016/j.arth.2021.12.035",
      "year": 2022,
      "journal": "The Journal of arthroplasty",
      "doi": "10.1016/j.arth.2021.12.035",
      "pmid": "34979253",
      "citations": 53
    },
    {
      "title": "Patient-Specific TKA with the VELYS™ Robotic-Assisted Solution",
      "url": "https://doi.org/10.52198/22.sti.40.os1561",
      "year": 2022,
      "journal": "Surgical technology international",
      "doi": "10.52198/22.sti.40.os1561",
      "pmid": "35325451",
      "citations": 27
    },
    {
      "title": "Transition to Robotic Total Knee Arthroplasty With Kinematic Alignment is Associated With a Short Learning Curve and Similar Acute-Period Functional Recoveries",
      "url": "https://doi.org/10.7759/cureus.38872",
      "year": 2023,
      "journal": "Cureus",
      "doi": "10.7759/cureus.38872",
      "pmid": "37303372",
      "citations": 18
    },
    {
      "title": "VELYS robotic-assisted total knee arthroplasty: Enhanced accuracy and comparable early outcomes versus manual instrumentation during adoption",
      "url": "https://doi.org/10.1002/jeo2.70163",
      "year": 2025,
      "journal": "Journal of experimental orthopaedics",
      "doi": "10.1002/jeo2.70163",
      "pmid": "39931150",
      "citations": 10
    },
    {
      "title": "Early Clinical and Economic Outcomes for the VELYS Robotic-Assisted Solution Compared with Manual Instrumentation for Total Knee Arthroplasty",
      "url": "https://doi.org/10.1055/a-2343-2444",
      "year": 2024,
      "journal": "The journal of knee surgery",
      "doi": "10.1055/a-2343-2444",
      "pmid": "38866046",
      "citations": 10
    }
  ]
}
