{
  "id": "cornerstone_sentire",
  "name": "Sentire",
  "db_added": "2025-07-30",
  "introduction_year": 2025,
  "urls": [
    {
      "caption": "Cornerstone, Sentire",
      "url": "https://en.csrbtx.com/sentire/sentire-surgical-system"
    }
  ],
  "photos": [
    {
      "url": "https://mir-s3-cdn-cf.behance.net/project_modules/2800_webp/42a200216973933.67e60dabb728e.png",
      "site": "https://en.csrbtx.com/sentire/sentire-surgical-system"
    },
    {
      "url": "https://cdn.i-scmp.com/sites/default/files/d8/images/canvas/2025/05/26/949dc71e-62a0-4777-920d-2eb82a55a8f9_222e6d43.jpg",
      "site": "https://en.csrbtx.com/sentire/sentire-surgical-system"
    }
  ],
  "tags": [
    "RAMIS",
    "Teleoperated",
    "Single patient cart",
    "Multiple ports",
    "3+ instruments",
    "Stereo viewer",
    "Stereo endoscope",
    "Mechanical RCM",
    "Mechanical Cartesian manipulation",
    "Haptic",
    "Commercial"
  ],
  "usages": [
    "Abdominal",
    "Gynecological",
    "Thoracic",
    "Urological"
  ],
  "description": "The Sentire Surgical System (Model C1000) is a multiport teleoperated robotic platform developed by Cornerstone Robotics (Hong Kong, China) for robot-assisted minimally invasive surgery. Its mechanical and industrial design closely resembles the Intuitive Surgical da Vinci X across both the enclosed 3D stereoscopic surgeon console and the single column-mounted 4-arm patient cart with mechanical remote center of motion (RCM) linkages. Operating wristed articulating laparoscopic instruments and a 3D HD endoscope, the Sentire C1000 received China NMPA approval in 2024 and European CE MDR certification in 2026 for general abdominal, urological, gynecological, and thoracic surgical procedures.",
  "also_known_as": [],
  "videos": [
    {
      "url": "https://www.youtube.com/watch?v=hs5QeCS8SBY",
      "title": "Cornerstone Robotics - Sentire"
    },
    {
      "url": "https://www.youtube.com/watch?v=ylFQ6XI71yo",
      "title": "Introducing Sentire Surgical System"
    },
    {
      "url": "https://www.youtube.com/watch?v=bAMeQBHwMjk",
      "title": "Sentire Surgical Robot Aging Test"
    }
  ],
  "regulatory": [
    {
      "url": "https://en.csrbtx.com/news/",
      "body": "CE",
      "year": 2026,
      "product_code": "",
      "panel": ""
    }
  ],
  "publications": [
    {
      "title": "Evaluation of the safety and efficacy of the Sentire Surgical System (C1000) for robot-assisted radical prostatectomy",
      "url": "https://doi.org/10.12809/hkmj2412169",
      "year": 2025,
      "journal": "Hong Kong medical journal = Xianggang yi xue za zhi",
      "doi": "10.12809/hkmj2412169",
      "pmid": "40461168",
      "citations": 1
    }
  ],
  "units_deployed": {
    "count": 15,
    "source_url": "https://www.cs-robotics.com/"
  }
}
